{
  "schema_version": "0.1",
  "market": "US",
  "snapshot_id": "us-demo-20260816",
  "data_mode": "fixture",
  "pit_quality": "FIXTURE",
  "as_of": "2026-08-15T16:00:00-04:00",
  "retrieved_at": "2026-08-16T10:30:00-04:00",
  "fixture_notice": "All issuers, symbols, URLs, events, facts, and conclusions in this fixture are synthetic test data only; they do not represent real issuers, real market facts, or investment recommendations.",
  "market_context": {
    "regime": "Synthetic risk-on tape with selective follow-through in automation infrastructure.",
    "breadth": "Synthetic breadth improved as two of three tracked demo cohorts advanced on rising volume.",
    "rates": "Synthetic front-end yields eased while long-end yields stayed range-bound.",
    "liquidity": "Synthetic liquidity remained sufficient for follow-on participation but not broad speculation.",
    "calculation_note": "Derived from deterministic fixture inputs only; replace with production venue and macro snapshots before research use.",
    "evidence_refs": ["EV-MARKET-001", "EV-BREADTH-001", "EV-RATES-001"]
  },
  "evidence": [
    {
      "evidence_id": "EV-MARKET-001",
      "source_level": "structured_market",
      "category": "market_price",
      "title": "DEMOA synthetic closing tape and relative strength",
      "summary": "Synthetic venue-normalized close and turnover data show DEMOA outperforming other fixture names on the snapshot date.",
      "source_url": "https://market.example.invalid/us/demoa/close-20260815",
      "source_document_id": "doc-market-demoa-20260815",
      "published_at": "2026-08-15T16:05:00-04:00",
      "effective_at": "2026-08-15T16:00:00-04:00",
      "available_at": "2026-08-15T16:05:00-04:00",
      "retrieved_at": "2026-08-16T07:50:00-04:00",
      "as_of": "2026-08-15T16:00:00-04:00"
    },
    {
      "evidence_id": "EV-BREADTH-001",
      "source_level": "structured_market",
      "category": "market_breadth",
      "title": "Synthetic automation cohort breadth snapshot",
      "summary": "Synthetic breadth data show the automation fixture basket widened from one advancing name to two.",
      "source_url": "https://market.example.invalid/us/automation/breadth-20260815",
      "source_document_id": "doc-breadth-automation-20260815",
      "published_at": "2026-08-15T16:07:00-04:00",
      "effective_at": "2026-08-15T16:00:00-04:00",
      "available_at": "2026-08-15T16:07:00-04:00",
      "retrieved_at": "2026-08-16T07:51:00-04:00",
      "as_of": "2026-08-15T16:00:00-04:00"
    },
    {
      "evidence_id": "EV-RATES-001",
      "source_level": "structured_market",
      "category": "rates",
      "title": "Synthetic Treasury curve checkpoint",
      "summary": "Synthetic rates data show stable long-end funding conditions relative to the prior fixture session.",
      "source_url": "https://market.example.invalid/us/rates/curve-20260815",
      "source_document_id": "doc-rates-curve-20260815",
      "published_at": "2026-08-15T16:10:00-04:00",
      "effective_at": "2026-08-15T16:00:00-04:00",
      "available_at": "2026-08-15T16:10:00-04:00",
      "retrieved_at": "2026-08-16T07:52:00-04:00",
      "as_of": "2026-08-15T16:00:00-04:00"
    },
    {
      "evidence_id": "EV-SEC-001",
      "source_level": "official",
      "category": "sec_filing",
      "title": "DEMOA synthetic annual filing",
      "summary": "Synthetic filing states DEMOA expanded revenue and maintained positive free cash flow over the trailing twelve months.",
      "source_url": "https://sec.example.invalid/us/demoa/10k-20260814",
      "source_document_id": "doc-sec-demoa-10k-20260814",
      "published_at": "2026-08-14T17:30:00-04:00",
      "effective_at": "2026-08-14T17:30:00-04:00",
      "available_at": "2026-08-14T17:30:00-04:00",
      "retrieved_at": "2026-08-16T07:40:00-04:00",
      "as_of": "2026-08-14T17:30:00-04:00"
    },
    {
      "evidence_id": "EV-IR-001",
      "source_level": "official",
      "category": "issuer_ir",
      "title": "DEMOA synthetic investor presentation",
      "summary": "Synthetic issuer IR materials attribute margin expansion to recurring software attach and service utilization.",
      "source_url": "https://ir.example.invalid/us/demoa/presentation-q2",
      "source_document_id": "doc-ir-demoa-q2-20260815",
      "published_at": "2026-08-15T08:00:00-04:00",
      "effective_at": "2026-08-15T08:00:00-04:00",
      "available_at": "2026-08-15T08:00:00-04:00",
      "retrieved_at": "2026-08-16T07:41:00-04:00",
      "as_of": "2026-08-15T08:00:00-04:00"
    },
    {
      "evidence_id": "EV-MACRO-001",
      "source_level": "official",
      "category": "official_macro",
      "title": "Synthetic public-sector automation budget update",
      "summary": "Synthetic macro release indicates incremental budget capacity for automation pilots in the next procurement cycle.",
      "source_url": "https://macro.example.invalid/us/automation-budget-20260815",
      "source_document_id": "doc-macro-automation-20260815",
      "published_at": "2026-08-15T09:00:00-04:00",
      "effective_at": "2026-08-15T09:00:00-04:00",
      "available_at": "2026-08-15T09:00:00-04:00",
      "retrieved_at": "2026-08-16T07:42:00-04:00",
      "as_of": "2026-08-15T09:00:00-04:00"
    },
    {
      "evidence_id": "EV-INDUSTRY-001",
      "source_level": "industry",
      "category": "supply_chain",
      "title": "Synthetic integrator backlog survey",
      "summary": "Synthetic survey suggests system integrators are prioritizing platform suppliers over one-off component vendors.",
      "source_url": "https://industry.example.invalid/us/integrator-backlog-20260815",
      "source_document_id": "doc-industry-backlog-20260815",
      "published_at": "2026-08-15T11:00:00-04:00",
      "effective_at": "2026-08-15T11:00:00-04:00",
      "available_at": "2026-08-15T11:00:00-04:00",
      "retrieved_at": "2026-08-16T07:43:00-04:00",
      "as_of": "2026-08-15T11:00:00-04:00"
    },
    {
      "evidence_id": "EV-SECONDARY-001",
      "source_level": "secondary",
      "category": "attention",
      "title": "Synthetic newsletter attention tracker",
      "summary": "Synthetic secondary commentary shows rising attention around automation platforms but lacks issuer-level proof on its own.",
      "source_url": "https://secondary.example.invalid/us/automation-attention-20260815",
      "source_document_id": "doc-secondary-attention-20260815",
      "published_at": "2026-08-15T13:00:00-04:00",
      "effective_at": "2026-08-15T13:00:00-04:00",
      "available_at": "2026-08-15T13:00:00-04:00",
      "retrieved_at": "2026-08-16T07:44:00-04:00",
      "as_of": "2026-08-15T13:00:00-04:00"
    },
    {
      "evidence_id": "EV-FUTURE-001",
      "source_level": "official",
      "category": "regulatory",
      "title": "Synthetic post-cutoff procurement shortlist notice",
      "summary": "This synthetic notice becomes available after the default demo decision time and exists only to test time-leak handling.",
      "source_url": "https://regulator.example.invalid/us/post-cutoff-shortlist-20260816",
      "source_document_id": "doc-regulatory-shortlist-20260816",
      "published_at": "2026-08-16T10:00:00-04:00",
      "effective_at": "2026-08-20T09:00:00-04:00",
      "available_at": "2026-08-16T10:00:00-04:00",
      "retrieved_at": "2026-08-16T10:01:00-04:00",
      "as_of": "2026-08-16T10:00:00-04:00"
    }
  ],
  "financial_facts": [
    {
      "fact_id": "FACT-DEMOA-REV-TTM",
      "security_id": "US.DEMOA",
      "metric": "revenue_ttm",
      "value": 240000000.0,
      "unit": "USD",
      "period_end": "2026-06-30",
      "available_at": "2026-08-14T17:30:00-04:00",
      "evidence_ref": "EV-SEC-001"
    },
    {
      "fact_id": "FACT-DEMOA-OPINC-TTM",
      "security_id": "US.DEMOA",
      "metric": "operating_income_ttm",
      "value": 42000000.0,
      "unit": "USD",
      "period_end": "2026-06-30",
      "available_at": "2026-08-14T17:30:00-04:00",
      "evidence_ref": "EV-SEC-001"
    },
    {
      "fact_id": "FACT-DEMOA-FCF-TTM",
      "security_id": "US.DEMOA",
      "metric": "free_cash_flow_ttm",
      "value": 30000000.0,
      "unit": "USD",
      "period_end": "2026-06-30",
      "available_at": "2026-08-14T17:30:00-04:00",
      "evidence_ref": "EV-SEC-001"
    },
    {
      "fact_id": "FACT-DEMOA-CASH",
      "security_id": "US.DEMOA",
      "metric": "cash_and_equivalents",
      "value": 90000000.0,
      "unit": "USD",
      "period_end": "2026-06-30",
      "available_at": "2026-08-14T17:30:00-04:00",
      "evidence_ref": "EV-SEC-001"
    },
    {
      "fact_id": "FACT-DEMOA-DEBT",
      "security_id": "US.DEMOA",
      "metric": "total_debt",
      "value": 25000000.0,
      "unit": "USD",
      "period_end": "2026-06-30",
      "available_at": "2026-08-14T17:30:00-04:00",
      "evidence_ref": "EV-SEC-001"
    },
    {
      "fact_id": "FACT-DEMOA-SHARES",
      "security_id": "US.DEMOA",
      "metric": "diluted_shares",
      "value": 12000000.0,
      "unit": "shares",
      "period_end": "2026-06-30",
      "available_at": "2026-08-14T17:30:00-04:00",
      "evidence_ref": "EV-SEC-001"
    },
    {
      "fact_id": "FACT-DEMOA-CLOSE",
      "security_id": "US.DEMOA",
      "metric": "close_price",
      "value": 18.5,
      "unit": "USD/share",
      "period_end": "2026-08-15",
      "available_at": "2026-08-15T16:05:00-04:00",
      "evidence_ref": "EV-MARKET-001"
    }
  ],
  "themes": [
    {
      "theme_id": "theme-us-automation-platforms",
      "name": "Synthetic automation platform upgrade cycle",
      "event_type": "budget_expansion",
      "stage": "confirming",
      "dimensions": {
        "materiality": {
          "assessment": "strong",
          "reason": "Synthetic filings and macro inputs imply enough demand to matter for platform revenue and margins.",
          "evidence_refs": ["EV-SEC-001", "EV-MACRO-001"]
        },
        "novelty": {